<?xml version="1.0" encoding="utf-8"?>
<!DOCTYPE Bean SYSTEM "bean.dtd">
<Bean>
	<Name>ActionTemplates</Name>
	<Solution>WTTH</Solution>
	<Package>com.hpe.ov.activator.inventory</Package>
	<DBTable>GENSERV_Action_Templates</DBTable>
	<Fields>
		<Field mandatory="true" update="false">
			<Name>service</Name>
			<Column>SERVICE</Column>
			<Type>String</Type>
			<Description>service primary key</Description>
		</Field>
		<Field mandatory="false">
			<Name>actionName</Name>
			<Column>ACTION_NAME</Column>
			<Type>String</Type>
			<Description>action name primary key</Description>
		</Field>
		<Field mandatory="false">
			<Name>networkElementType</Name>
			<Column>NETWWORK_ELEMENT_TYPE</Column>
			<Type>String</Type>
			<Description>network element type</Description>
		</Field>
		<Field mandatory="false">
			<Name>templateName</Name>
			<Column>TEMPLATE_NAME</Column>
			<Type>String</Type>
			<Description>template name</Description>
		</Field>
	</Fields>
	<Keys>
		<Key pk="true">
			<KeyField>service</KeyField>
			<KeyField>actionName</KeyField>
		</Key>
	</Keys>
	<Operations>
		<Store/>
		<Update/>
		<Remove/>
		<FindBy>
			<OrderField>service</OrderField>
		</FindBy>
	</Operations>
</Bean>
