<?xml version="1.0" encoding="utf-8"?>
<!DOCTYPE Bean SYSTEM "bean.dtd">
<Bean>
	<Name>MovtoIMS</Name>
	<Solution>WTTH</Solution>
	<Package>com.hpe.ov.activator.inventory</Package>
	<DBTable>WTTH_lrt_mov_to_ims</DBTable>
	<Fields>
		<Field mandatory="true" update="false" dateFormat="EEE MMM dd HH:mm:ss zzz yyyy">
			<Name>requestDate</Name>
			<Column>REQUEST_DATE</Column>
			<Type>Date</Type>
			<Description>request Date</Description>
		</Field>
		<Field mandatory="true">
			<Name>mobileNumber</Name>
			<Column>MOBILE_NUMBER</Column>
			<Type>String</Type>
			<Description>mobile phone number</Description>
		</Field>
		<Field mandatory="false">
			<Name>fixedNumber</Name>
			<Column>FIXED_NUMBER</Column>
			<Type>String</Type>
			<Description>fixed phone number</Description>
		</Field>
		<Field mandatory="false">
			<Name>aux1</Name>
			<Column>AUX1</Column>
			<Type>String</Type>
			<Description>auxiliar field</Description>
		</Field>
	</Fields>
	<Keys>
		<Key pk="true">
			<KeyField>mobileNumber</KeyField>
		</Key>
	</Keys>
	<Operations>
		<Store/>
		<Update/>
		<Remove/>
		<FindBy>
			<OrderField>mobileNumber</OrderField>
		</FindBy>
	</Operations>
</Bean>
