<?xml version="1.0" encoding="utf-8"?>
<!DOCTYPE Bean SYSTEM "bean.dtd">
<Bean>
	<Name>ServiceParams</Name>
	<Solution>WTTH</Solution>
	<Package>com.hpe.ov.activator.inventory</Package>
	<DBTable>GENSERV_Service_Params</DBTable>
	<Fields>
		<Field mandatory="true" upDate="false">
			<Name>serviceId</Name>
			<Column>SERVICE_ID</Column>
			<Type>String</Type>
			<Description>service primary key</Description>
		</Field>
		<Field mandatory="true">
			<Name>customerId</Name>
			<Column>CUSTOMER_ID</Column>
			<Type>String</Type>
			<Description>customer id</Description>
		</Field>
		<Field mandatory="false">
			<Name>paramName</Name>
			<Column>PARAM_NAME</Column>
			<Type>String</Type>
			<Description>parameter name</Description>
		</Field>
		<Field mandatory="false">
			<Name>paramValue</Name>
			<Column>PARAM_VALUE</Column>
			<Type>String</Type>
			<Description>parameter value</Description>
		</Field>
		<Field mandatory="false">
			<Name>aux1</Name>
			<Column>AUX1</Column>
			<Type>long</Type>
			<Description>auxiliar field</Description>
		</Field>
		<Field mandatory="false">
			<Name>metada</Name>
			<Column>METADATA</Column>
			<Type>long</Type>
			<Description>additional info</Description>
		</Field>
	</Fields>
	<Keys>
		<Key pk="true">
			<KeyField>SERVICE_ID</KeyField>
		</Key>
		<Key unique="false" makeIndex="true">
			<Name>customerId</Name>
			<KeyField>CUSTOMER_ID</KeyField>
		</Key>
		<Key unique="false" makeIndex="true">
			<Name>paramName</Name>
			<KeyField>PARAM_NAME</KeyField>
		</Key>
	</Keys>
	<Operations>
		<Store/>
		<UpDate/>
		<Remove/>
		<FindBy>
			<OrderField>SERVICE_ID</OrderField>
		</FindBy>
		<FindBy key="customerId">
			<OrderField>SERVICE_ID</OrderField>
		</FindBy>
		<FindBy key="paramName">
			<OrderField>SERVICE_ID</OrderField>
		</FindBy>
	</Operations>
</Bean>
