<?xml version="1.0" encoding="utf-8"?>
<!DOCTYPE Bean SYSTEM "bean.dtd">
<Bean>
	<Name>Action Templates</Name>
	<Solution>WTTH</Solution>
	<Package>com.hpe.ov.activator.inventory</Package>
	<DBTable>GENSERV_Action_Templates</DBTable>
	<Fields>
		<Field mandatory="true" update="false">
			<Name>service</Name>
			<Type>string</Type>
			<Description>service primary key</Description>
		</Field>
		<Field mandatory="falso">
			<Name>action_name</Name>
			<Type>string</Type>
			<Description>action name primary key</Description>
		</Field>
		<Field mandatory="false">
			<Name>network_element_type</Name>
			<Type>string</Type>
			<Description>network element type</Description>
		</Field>
		<Field mandatory="false">
			<Name>template_name</Name>
			<Type>string</Type>
			<Description>template_name</Description>
		</Field>
	</Fields>
	<Keys>
		<Key pk="true">
			<KeyField>service</KeyField>
			<KeyField>action_name</KeyField>
		</Key>
	</Keys>
</Bean>
