<?xml version="1.0" encoding="utf-8"?>
<!DOCTYPE Bean SYSTEM "bean.dtd">
<Bean>
	<Name>Customer</Name>
	<Solution>WTTH</Solution>
	<Package>com.hpe.ov.activator.inventory</Package>
	<DBTable>GENSERV_Customer</DBTable>
	<Fields>
		<Field mandatory="true" upDate="false">
			<Name>customerId</Name>
			<Column>CUSTOMER_ID</Column>
			<Type>String</Type>
			<Description>customer primary key</Description>
		</Field>
		<Field mandatory="false">
			<Name>accountNumber</Name>
			<Column>ACCOUNT_NUMBER</Column>
			<Type>String</Type>
			<Description>account number</Description>
		</Field>
		<Field mandatory="false">
			<Name>customer</Name>
			<Column>CUSTOMER</Column>
			<Type>String</Type>
			<Description>customer</Description>
		</Field>
		<Field mandatory="false">
			<Name>emaiLCustomer</Name>
			<Column>EMAIL_CUSTOMER</Column>
			<Type>String</Type>
			<Description>Email customer</Description>
		</Field>
		<Field mandatory="false">
			<Name>passwordCustomer</Name>
			<Column>PASSWORD_CUSTOMER</Column>
			<Type>String</Type>
			<Description>Password Customer</Description>
		</Field>
		<Field mandatory="false">
			<Name>aux1</Name>
			<Column>AUX1</Column>
			<Type>Long</Type>
			<Description>auxiliar field</Description>
		</Field>
		<Field mandatory="false">
			<Name>metada</Name>
			<Column>METADATA</Column>
			<Type>Long</Type>
			<Description>additional info</Description>
		</Field>
	</Fields>
	<Keys>
		<Key pk="true">
			<KeyField>CUSTOMER_ID</KeyField>
		</Key>
		<Key unique="false" makeIndex="true">
			<Name>accountNumber</Name>
			<KeyField>ACCOUNT_NUMBER</KeyField>
		</Key>
	</Keys>
	<Operations>
		<Store/>
		<UpDate/>
		<Remove/>
		<FindBy>
			<OrderField>CUSTOMER_ID</OrderField>
		</FindBy>
		<FindBy key="accountNumber">
			<OrderField>CUSTOMER_ID</OrderField>
		</FindBy>
	</Operations>
</Bean>
